PairID,Text,Score
ENG-train-1371,"२००० पर्यंत लोकसंख्या १५,३४२ होती.
शेर्वानची लोकसंख्या १५ हजारांहून अधिक आहे.",0.66
ENG-train-1372,"तिला वेस्टमिस्टर अभयात दफन करण्यात आलं होतं.
तिला स्पीयर कॅथेड्रलमध्येही दफन करण्यात आलं होतं.",0.66
ENG-train-1373,"पण, त्याची स्वतःची वेबसाईट आहे.
ठीक आहे, ते वेबसाईटवर आहेत.",0.66
ENG-train-1374,"जुन्या शॉन टाउन, इलिनॉय या ऐतिहासिक गावासाठी पहा.
शॉनटाउन हे अमेरिकेतील इलिनॉय राज्यातील एक शहर आहे.",0.66
ENG-train-1375,"@realDonaldTrump हे कौतुकास्पद आहे की आपण अधिक चांगल्यासाठी प्रायोजक गमावण्यास कसे तयार आहात. आपल्यासारख्या आवाजाची आम्ही आतुरतेने वाट पाहिली आहे!
मला फक्त माझ्या ################################################################################################################################################################################################################################################################################################################################################################################################################################",0.66
ENG-train-1376,"तथापि, लेस्बियनमध्ये यापैकी कोणतीही प्रथा विशेषतः सामान्य नाही.
पण सामान्यतः समलैंगिक स्त्रियांसोबत असं होत नाही.",0.66
ENG-train-1377,"मग मुले आई-वडिलांच्या पाठीशी उभी राहतात.
आई-वडिलांनी मुलांची काळजी घेतली आणि नंतर आई-वडिलांची काळजी घेतली.",0.66
ENG-train-1378,"या यादीतील काही चित्रपट देखील `` लेखक'चित्रपट, स्वतंत्र चित्रपट किंवा प्रयोगात्मक चित्रपट मानले जातात.
काही लोक त्यांना कला चित्रपट, स्वतंत्र चित्रपट, इंडी चित्रपट, आर्टहाऊस चित्रपट, लेखक चित्रपट किंवा प्रयोगात्मक चित्रपट म्हणतात.",0.66
ENG-train-1379,"तू काही मैत्रिणींना बोलावणार होतीस?
तुझ्या काही मैत्रिणी होत्या ना?",0.66
ENG-train-1380,"नारिंगी गणवेश घातलेला बास्केटबॉल खेळाडू मागे वळून पाहतो.
बास्केटबॉल खेळाडू ऑरेंज स्नीकर्स घालतो.",0.66
ENG-train-1381,"ड्यूसला रॉड शोधण्यात काही अडचण येत आहे.
त्याची छडी शोधणे ही ड्यूसची समस्या आहे.",0.66
ENG-train-1382,"येथे भेट देण्यासाठी एक चांगली वेबसाईट आहे:
ultimate-guitar.com या संकेतस्थळावर जा आणि टॅब शोधा.",0.66
ENG-train-1383,"माझ्या खाली लगेच एक मोठी खोली उघडली गेली होती.
मोठी खोली आता माझ्याखाली होती.",0.66
ENG-train-1384,"दूरवरून तुम्हाला शांतता आणि अंधार जवळ येत असल्याचे जाणवते.
अंतर अंधारात आणि शांततेत येते.",0.66
ENG-train-1385,"तिच्या चाहत्यांपैकी कोणीही नाही, का?
फक्त तिच्या संगीताचा आनंद घ्या, पण तिच्या चाहत्यांपैकी नाही, का?",0.66
ENG-train-1386,"मला अजूनही हे अविश्वसनीय वाटते की शो किती चांगला आहे.
कदाचित मला टीव्ही शो जास्त आवडतो.",0.66
ENG-train-1387,"मध्यरात्रीपेक्षा खोल हे हंटर आणि कॉरिन यांची कहाणी आहे.
आणि खरंच, मला ते आवडलं, विशेषतः जेव्हा आम्ही हॅन्टर आणि कॉरिनला न्यू ऑरलियन्सच्या एका छोट्या बारमध्ये प्रथमच चुंबन घेताना पाहिलं.",0.66
ENG-train-1388,"तुम्ही गर्भपाताच्या विरोधात कसे आहात आणि गरिबांसाठी मोफत गर्भनिरोधक क्लिनिक काढून घेऊ इच्छिता? कसे?
मला अजूनही विश्वास आहे की स्त्रियांना निवड करण्याची क्षमता असावी.",0.66
ENG-train-1389,"एक लहान बाळ तलावाजवळील खडकावर उभे आहे.
छोटं बाळ पार्कमधील खडकांवर बसतं.",0.66
ENG-train-1390,"मला असे वाटत नाही; तुम्हाला निर्णय घ्यावा लागेल.
खरं तर नाही, तुम्हीच न्यायाधीश व्हायला हवेत.",0.66
ENG-train-1391,"लेक्सिंग्टन शहराची स्थापना 6 मे 1782 रोजी व्हर्जिनिया महासभेच्या कायद्याने झाली.
१७७९ साली याच ठिकाणी एक किल्ला बांधला गेला आणि १७८२ सालापर्यंत येथे लेक्सिंग्टन, व्हर्जिनिया नावाचा एक शहर होता.",0.66
ENG-train-1392,"ब्रिटिशांनी दोन अयशस्वी प्रत-आक्रमण केले पण आणखी दोन टेकड्यांवर इटालियन हल्ले रोखले.
ब्रिटिशांनी दोन अयशस्वी आक्रमणे केली पण दुसऱ्या दिवशी त्यांना इतर दोन डोंगर सोडून जाण्यास भाग पाडले.",0.66
ENG-train-1393,"सकाळी सहा वाजता 1500 युरो ड्रिंक्स त्यांनी खाल्ले नाहीत.
सकाळी सहा वाजता मला जेवण आणि पेय साठी १५३६ युरो द्यावे लागतात.",0.66
ENG-train-1394,"चार मुले बाहेर खेळाच्या मैदानावर हिरव्या आणि पिवळा चेंडू घेऊन आहेत.
हिरव्या व पिवळा फूटबॉल युनिफॉर्म परिधान केलेली मुले फुटबॉल चेंडूच्या मागे धावतात",0.66
ENG-train-1395,"त्याच्या वेबसाईटवर जाऊन बघा.
गमावलेल्या वेबसाईटवर जाऊन बघा!",0.66
ENG-train-1396,"एअर न्यूझीलंडचे मार्ग नेटवर्क ऑस्ट्रेलिया आणि दक्षिण पॅसिफिकवर केंद्रित आहे, आशिया, युरोप आणि उत्तर अमेरिका या देशांमध्ये लांब पल्ल्याच्या सेवांसह.
ते प्रामुख्याने ऑस्ट्रेलिया आणि दक्षिण पॅसिफिकमध्ये उड्डाण करते, परंतु युरोप, उत्तर अमेरिका आणि आशियालाही सेवा देते.",0.66
ENG-train-1397,"मला एक मिनिट द्या, मी जे करत आहे ते पूर्ण करू दे.
मला एक सेकंद द्या. मी काहीतरी करीन.",0.66
ENG-train-1398,"मिठाईचे स्वप्न"" लिंडा विन्स्टाड जोन्स - हा एक रोमँटिक नाही तर भयपट होता.
लिंडा विन्स्टॅड जोन्सच्या ""द स्वीट ड्रीम्स"" या पुस्तकात एक अनपेक्षित आनंद झाला.",0.66
ENG-train-1399,"नारिंगी ड्रेस असलेली व्यक्ती रेल्वेपट्टीवर काम करत आहे.
ऑरेंज स्कर्ट असलेला वृद्ध माणूस पाण्याची नाली पकडत होता.",0.66
ENG-train-1400,"इ. स. १८३० च्या जानेवारी महिन्यात स्टर्टच्या पक्षाने मुरम्बidgee आणि मोठ्या नदीच्या संयोगात पोहोचले, ज्याला स्टर्टने मुर्रे नदी असे नाव दिले.
तिथून स्टर्टने छोट्या बोटाने नदीत प्रवास केला आणि १४ जानेवारी १८३० रोजी मरे नदीवर पोहोचला.",0.66
ENG-train-1401,"या नियमांची अंमलबजावणी करण्याची यंत्रणा; (ग) अनुपालन देखरेख करण्याची योग्य यंत्रणा.
(ग) नियमांच्या अनुपालनाची देखरेख करण्यासाठी योग्य यंत्रणा.",0.66
ENG-train-1402,"ते थोडे आत आणि बाहेर जातात, नाही का?
ते थोडे बाहेर जात आहेत, नाही का?",0.66
ENG-train-1403,"प्रत्यक्षात, ड्राइव्ह अनेकदा समान वयोगटातील, समान परिधान आहे.
पण प्रत्यक्षात हे ड्राइव्ह अनेकदा एकत्र खरेदी केले जात होते.",0.66
ENG-train-1404,"मला केट आणि हेन्री बद्दल थोडे अधिक जाणून घेणे आवडले, जेम्स देखील.
जेम्सने केटच्या असुरक्षिततेला चालना दिली आहे आणि हेन्रीला चांगले करण्यासाठी केटचा वापर करत आहे, आणि जेम्स हाताळणारा आहे!",0.66
ENG-train-1405,"या परिस्थितीत कोणतीही सुरक्षा यंत्रणा इतकी निरपेक्ष असू शकत नाही.
अशा परिस्थितीत, पूर्ण सुरक्षा प्रणाली प्रदान केली गेली नाही.",0.66
ENG-train-1406,"मला डोनाल्ड ट्रम्प यांना राष्ट्रपतीपदावर विजय मिळवायचा आहे. तो इतरांसारखा विकले जाऊ शकत नाही. आणि तो आपल्या विश्वासार्हतेवर ठाम राहतो.
@NBCNews @realDonaldTrump किंवा व्हाईट हाऊस!! #trumpforpresident",0.66
ENG-train-1407,"रस्त्याच्या कडेला शॉर्ट्समध्ये स्केटबोर्ड घालणारा एक माणूस.
एक तरुण गुलाबी रेल्वेतून स्केटबोर्डवर उतरतो.",0.66
ENG-train-1408,"फुटबॉल खेळाडू मैदानावर आहेत, एक जण चेंडू पाडण्याच्या तयारीत आहे, आणि दुसरा त्याच्याकडून ते चोरण्याचा प्रयत्न करीत आहे.
एक लाल शर्ट असलेला फुटबॉल खेळाडू चेंडू पाडतो तर काळा शर्ट असलेला दुसरा खेळाडू त्याला थांबवण्याचा प्रयत्न करतो.",0.66
ENG-train-1409,"चित्रांच्या गुणवत्तेबद्दल मला खेद आहे.
ती दर्जाची तिसरी किंवा चौथी पिढी आहे.",0.66
ENG-train-1410,"फळ पातळ तुकडे करून भिजवले जाते किंवा मध किंवा साखरेमध्ये शिजवले जाते.
या बहुमुखी पाककृतीला अनेकदा साखर, मसाला, फळे, सिरप किंवा इतर पदार्थांनी भरले जाते.",0.66
ENG-train-1411,"त्याची ध्वनिकता अचानक बदलली; ती अचानक खूप मोठी झाली होती.
अचानक तिच्याकडे वेगळी ध्वनिकता होती, जणू अचानक ती मोठी झाली होती.",0.66
ENG-train-1412,"मला विघोल्फ आणि रोना खूप आवडले.
या पुस्तकात रोना अँड विघोल्फ बद्दलही आहे.",0.66
ENG-train-1413,"एकूणच, सॅन्डर्सनचे लघुकथा लेखन त्याच्या कादंबरी लांबीच्या लिखाणाइतके आकर्षक नाही.
सॅन्डर्सनच्या कामातील बहुतेक गोष्टींपेक्षा खूपच भितीदायक गोष्ट.",0.66
ENG-train-1414,"फ्रेडी जिंकला असता. त्याने जेसनला काय केलं?
'फ्रेडी vs. जेसन' या चित्रपटात मी जेसनसोबत सहानुभूती व्यक्त केली होती.",0.66
ENG-train-1415,"त्याच्या स्वाक्षरीला प्राप्त होणे कठिण होते.
तो अडचणींना सामोरे गेला.",0.66
ENG-train-1416,"पण केन्झीने त्याला आराम करण्याचे कारण दिले आहे.
इथेन, केन्झीच्या मदतीने, थोडेसे कमी बचावात्मक आहे, थोडेसे कमी गोंधळलेला आणि गोंधळलेला आहे.",0.66
ENG-train-1417,"जर तुम्ही यंग फॅन्टेसीचे चाहते असाल तर क्रिस्टल वेडच्या डेब्यूच्या कादंबरी WILDE'S FIRE पेक्षा पुढे पाहू नका.
मी अंधारावर विजय मिळविण्यासाठी प्रेम आणि प्रकाशाची वाट पाहत आहे आणि क्रिस्टल वेडच्या भविष्यातील कादंबऱ्यांची वाट पाहत आहे.",0.66
ENG-train-1418,"मुले पिशव्या स्पर्धेत भाग घेतात.
चार मुले बाहेर एकत्र खेळत आहेत.",0.66
ENG-train-1419,"त्यापैकी सहा चक्रीवादळ बनले, त्यापैकी पाच चक्रीवादळ मोठ्या प्रमाणात झाले ज्याने सायफर सिम्पसन स्केलवर श्रेणी 3 किंवा त्याहून अधिक गाठली.
चक्रीवादळ फेलिक्स हा पाचवा श्रेणीचा चक्रीवादळ होता जो २००७ मध्ये मध्य अमेरिकेला धडकला होता.",0.66
ENG-train-1420,"हा स्टेशन बंद असावा, ते इथे काय करत होते?
ते बंद स्थानकावर का आले?",0.66
ENG-train-1421,"एक तपकिरी आणि काळा कुत्रा रंगीबेरंगी चेंडूच्या बाजूला पडला.
एक तपकिरी आणि काळा कुत्रा लाल चेंडू घेण्यासाठी धावतो.",0.66
ENG-train-1422,"एस्कोपेटारा हा सुधारित बंदुकापासून बनविलेला गिटार आहे, जो शांततेचे प्रतीक म्हणून वापरला जातो.
२००३ मध्ये पहिल्या एस्कोपेट्राला विन्चेस्टर रायफल आणि स्ट्रॅटोकेस्टर इलेक्ट्रिक गिटारचा वापर करण्यात आला होता.",0.66
ENG-train-1423,"त्याने रथाने रस्ता ओलांडला.
गर्दीचा रस्ता ओलांडणारे पादचारी आणि मोटारसायकलपटू",0.66
ENG-train-1424,"मी कल्पना केली की केली हिस्टेरिकल आहे आणि ओरडत आहे.
आणि केलीला कळत नाही की ती का ओरडत आहे.",0.66
ENG-train-1425,"बाहेरील बाजाराच्या विक्रेत्याने तिच्या स्टॉलला झाकणाऱ्या टेपवरून पावसाचे पाणी टाकण्यासाठी एक स्तंभ उचलला.
विक्रेते बाहेरच्या अन्न बाजारात आपली वस्तू विकतात, तर खरेदीदार खरेदी करतात.",0.66
ENG-train-1426,"पोर्ट आर्थरमध्ये अल्पवयीन कैद्यांचेही ठिकाण होते. तेथे अनेक मुले होती. काही मुले नऊ वर्षांची होती. त्यांना खेळणी चोरल्याबद्दल अटक करण्यात आली होती.
ते लहान मुलांसाठी होते, काही मुले 9 वर्षांची होती, जसे जेम्स लिंच, खेळणी चोरल्याबद्दल अटक करण्यात आली होती.",0.66
ENG-train-1427,"अॅमनिओट्स जगभरात पसरले आणि ते पृथ्वीवरील वर्टीब्रेट बनले.
जवळजवळ सर्व कशेरुक प्राणी जे मुख्यतः जमिनीवर राहतात ते अम्निओट्स आहेत.",0.66
ENG-train-1428,"या प्रकरणाची सत्यता समजून घ्या.
माफ करा पण ही सत्यता आहे!",0.66
ENG-train-1429,"चोलिस्तान वाळवंट पाकिस्तानच्या पंजाब प्रांतात पसरलेल्या थार वाळवंटात शेजारी आहे.
पाकिस्तानच्या पंजाब प्रांतामध्ये ते चोलिस्तान वाळवंट म्हणून ओळखले जाते.",0.66
ENG-train-1430,"नेहमीप्रमाणे, एकही वाईट नोरा रॉबर्ट्स वाचली नाही!
एक प्रकारची नोरा रॉबर्ट्स, जशी ती तुम्हाला आकर्षित करते.",0.66
ENG-train-1431,"एका शहरातून वाहणाऱ्या नदीत एक माणूस एकट्याने फिशिंग करतो.
एक नर नदीत उभा आहे आणि मासेमारी करत आहे आणि एक जाळी पकडत आहे.",0.66
ENG-train-1432,"एक स्त्री बटाट्याची कापणी करत आहे.
एक स्त्री टोमॅटो कापत आहे.",0.66
ENG-train-1433,"पांढरा पांढरा झाला आणि गरीब एल्ला तिच्या आईसाठी अस्तित्वात नव्हता.
क्लासिक सिंड्रेला कथेतील एक हुशार ट्विस्ट.",0.66
ENG-train-1434,"मला आणखी इझी, डेक्स आणि रोमीची गरज आहे!
मला DEX, Izzy, Anderson आणि Romy खूप आवडले.",0.66
ENG-train-1435,"डोबेल शहरात एक सांस्कृतिक केंद्र तसेच एक संग्रहालय आहे.
डोबेले हे लातवियातील एक शहर असून १९१७ पासून ते शहर आहे.",0.66
ENG-train-1436,"हे फॅन फिक्शन कसं बनतं?
माझ्या मते, ही फॅन फिक्शन आहे.",0.66
ENG-train-1437,"निआगरा फॉल्स हे हॉर्सशो फॉल्स आणि अमेरिकन फॉल्समध्ये विभागले गेले आहे.
Horseshoe Falls हे तीन झरेंपैकी सर्वात मोठे झरे आहेत.",0.66
ENG-train-1438,"अचानक माझ्यासमोर एक डोकावून घेणारे गड उघडले.
येथे तो एक डोकेदुखी गड उघडते.",0.66
ENG-train-1439,"कारण मी असेल तर मी तुला सांगेन.
कारण मला एक मिळालं असतं तर मी तुला सांगितलं असतं.",0.66
ENG-train-1440,"' मी एक मुलगी चुंबन'च्या व्यंग्यादेखील चार्ट यशस्वी होत आहेत.
ती जिल सोबूलच्या'मी एका मुलीला चुंबन दिले'च्या गाण्याइतकीही चांगली नाही.",0.66
ENG-train-1441,"जर थर्मोडायनामिक स्पेसमध्ये आयाम असतील तर तेथील अद्वितीय थर्मोडायनामिक क्षमता आहेत.
थर्मोडायनामिक्समध्ये, थर्मोडायनामिक संभाव्यता ही थर्मोडायनामिक सिस्टमशी संबंधित मापदंड आहेत आणि त्यामध्ये ऊर्जेचा आकार असतो.",0.66
ENG-train-1442,"त्याचे नैसर्गिक वासस्थान म्हणजे जंगले आणि जंगले, प्रामुख्याने आर्द्र.
त्याचे नैसर्गिक निवासस्थान उपोष्णकटिबंधीय किंवा उष्णकटिबंधीय आर्द्र पर्वत आणि नद्या आहेत.",0.66
