PairID,Text,Score
ENG-train-0000,"जर असं झालं तर फक्त प्लग बंद करा.
जर असं कधी झालं तर फक्त प्लग बंद करा.",1.0
ENG-train-0001,"पाण्यातून धावणारा काळा कुत्रा.
काळा कुत्रा काही पाण्यातून पळत आहे.",1.0
ENG-train-0002,"मी तुमच्यासाठी संपूर्ण अभयारण्य शोधत होतो.
मी तुम्हाला सगळीकडे शोधत आहे.",1.0
ENG-train-0003,"जर तो सुंदर दिसत असेल आणि त्याचे व्यक्तिमत्व चांगले असेल, तर तो समलैंगिक असू शकतो - परंतु बहुधा बायसेक्सुअल आहे.
जर तो सुंदर दिसत असेल, आणि एक चांगला व्यक्तिमत्व असेल, तर तो हॅट असू शकतो, पण बहुधा बाय.",1.0
ENG-train-0004,"ती तुझ्यावर द्वेष करत नाही, ती फक्त तुझ्यावर रागावली आहे.
ती तुमचा द्वेष करत नाही, ती फक्त चिडली आहे.",1.0
ENG-train-0005,"अभिनेता गझारा वयाच्या ८१ व्या वर्षी मरण पावला
अभिनेता बेन गाझारा यांचे वयाच्या ८१ व्या वर्षी निधन झाले.",1.0
ENG-train-0006,"नाही, मला खरोखरच न्यू यॉर्क जिंकण्याची इच्छा नव्हती.
नाही, मला न्यू यॉर्क जिंकण्याची इच्छा नव्हती.",1.0
ENG-train-0007,"मला त्यांच्याशी काही अडचण नाही.
मला त्यांच्याशी काही अडचण नाही.",1.0
ENG-train-0008,"तुमच्या पालकांना तुमचा बॉयफ्रेंड आवडायचा नाही, तर तुम्हाला आवडतो.
तुमच्या आई-वडिलांनी तुमची बीएफ पसंत करण्याची गरज नाही, तुम्ही पसंत करता.",1.0
ENG-train-0009,"मला वाटते की टेलर खूप गोड आहे, पण मला त्याचा आवाज आवडत नाही.
मला वाटते की टेलर खूप गोड आहे. पण मला त्याचा आवाज आवडत नाही.",1.0
ENG-train-0010,"एक हलका तपकिरी कुत्रा आनंदाने मार्गावर धावतो.
एक पांढरा कुत्रा एका मार्गावर धावतो.",1.0
ENG-train-0011,"तुमच्या बॅगमध्ये चार वर्षाचा मुलगा.
तुमच्या खिशातल्या चार वर्षाच्या मुलाला",1.0
ENG-train-0012,"आपण नंतर शोधू शकता, की आपण परिपूर्ण एक गमावले आहे.
तुम्हाला नंतर कळेल की तुम्ही एक परिपूर्ण व्यक्ती गमावली आहे.",1.0
ENG-train-0013,"जर तिने सांगितले की तिला फक्त मैत्री करायची आहे, तर खूप उशीर झाला आहे.
जर ती म्हणाली की तिला फक्त मैत्री करायची आहे तर आधीच उशीर झाला आहे.",1.0
ENG-train-0014,"एक माणूस पॅनमध्ये तांदूळ घालत आहे.
एका माणसाने पॅनमध्ये रिक्-ए-रोनी ओतली.",1.0
ENG-train-0015,"मुलं विचित्र असू शकतात. मला माहित असले पाहिजे.
पुरुषांना विचित्र वाटू शकते. मला हे माहित असले पाहिजे.",1.0
ENG-train-0016,"एक तपकिरी कुत्रा उडी मारत आहे.
एक तपकिरी कुत्रा उडी मारत आहे",1.0
ENG-train-0017,"फ्रिट्झ लॅबँड हा एक जर्मन फुटबॉल खेळाडू होता.
फ्रिट्झ लॅबँड हा माजी जर्मन फुटबॉल खेळाडू आहे.",1.0
ENG-train-0018,"एका क्षणासाठीही या माणसावर विश्वास ठेवू नका.
एका क्षणासाठीही या माणसावर विश्वास ठेवू नका.",1.0
ENG-train-0019,"खास करून जर तुम्हाला तो खरोखरच आवडतो आणि तुम्हाला माहित असेल की तो लजाळू आहे.
खास करून जर तुम्हाला तो खरोखरच आवडला असेल आणि तुम्हाला माहित असेल की तो लजाळू आहे.",1.0
ENG-train-0020,"एक शेतकरी बाजारात एक माणूस.
एक माणूस शेतकरी बाजारात आहे.",1.0
ENG-train-0021,"२००० च्या जनगणनेनुसार लोकसंख्या ५१७ होती.
२००० पर्यंत लोकसंख्या ५१७ आहे.",1.0
ENG-train-0022,"गहन श्वास घ्या, हवेचा जास्तीत जास्त फायदा घ्या.
गहन श्वास घ्या, हवा आत येऊ द्या.",1.0
ENG-train-0023,"मी परत येण्यापूर्वी जर तुम्ही मला भेटाल तर कृपया मला थांबायला सांगा.
मी परत येण्यापूर्वी मला भेटायचं असेल तर कृपया मला थांबायला सांगा.",1.0
ENG-train-0024,"तू त्यांना अजून का सांगितलं नाहीस?
तू त्यांना अजून का सांगितलं नाहीस?",1.0
ENG-train-0025,"जेव्हा पाऊस पडतो तेव्हा मला अधिक आरामदायक वाटते.
जेव्हा पाऊस पडतो तेव्हा मी अधिक आरामदायक असतो.",1.0
ENG-train-0026,"रोमन लोकांमध्ये ग्लिरारियम नावाचा एक विशेष प्रकारचा आच्छादन होता ज्याचा उपयोग टेबलासाठी मागील झोपेसाठी केला जात होता.
रोमन लोकांची झोप ठेवण्यासाठी एक विशेष जागा होती ज्याला ग्लिरारियम म्हणतात.",0.97
ENG-train-0027,"ते लेओचं आहे आणि मला लेओ आवडत नाही.
..............................................................................................................................................................................................................................................................................................................................................................................................................................................................................................................................",0.97
ENG-train-0028,"कारण पिट्सबर्ग सुंदर आहे आणि प्रत्येकाला तिथे राहायचं असतं.
कारण पिट्सबर्ग आश्चर्यकारक आहे आणि प्रत्येकजण तिथे राहण्याची इच्छा करतो!",0.97
ENG-train-0029,"जेव्हा मी पुन्हा प्रयत्न केला, तेव्हा मी गोंगल करू शकलो.
जेव्हा मी त्याकडे परत गेलो, तेव्हा मी गोंगल करू शकलो!",0.97
ENG-train-0030,"तुम्ही कधी ""रॉबिन हूड: प्रिन्स ऑफ चोर"" हा चित्रपट पाहिला आहे का?
'रॉबिन हूड, प्रिन्स ऑफ चोर' हा चित्रपट पाहिला आहे का?",0.97
ENG-train-0031,"मी गिलिगन्सच्या बाळाबद्दल विनोद करत होतो. वचन!
मी गिलिगॅन्टच्या बाळाबद्दल विनोद करत होतो.",0.97
ENG-train-0032,"दोन कुत्रे रेड फायर हाइड्रंटवर पेशाब करत आहेत.
दोन कुत्रे रेड फायर हाइड्रंटवर पेशाब करत आहेत.",0.97
ENG-train-0033,"मी ज्या स्कर्टवर काम करत होतो त्यामध्ये मला मोठा यश मिळालं.
मी काम करत असलेल्या स्कर्टमध्ये काही प्रगती केली आहे.",0.97
ENG-train-0034,"२००० च्या जनगणनेनुसार लोकसंख्या १२७ होती.
२००० पर्यंत लोकसंख्या १२७ आहे.",0.97
ENG-train-0035,"एखाद्या मुलीच्या प्रेमात पडू नका, त्याऐवजी मुली तुमच्या प्रेमात पडू द्या.
PS: मुलीच्या प्रेमात पडू नकोस. मुली तुझ्या प्रेमात पडू दे!",0.97
ENG-train-0036,"माझ्यासाठी हा एक उत्तम क्षण होता, एक बाप म्हणून.
माझ्यासाठी एक पिता म्हणून, ही एक आश्चर्यकारक क्षण असला पाहिजे.",0.97
ENG-train-0037,"जॉर्ज, एलिझा आणि हॅरी यांनाही कॅनडामध्ये प्रवेश केल्यानंतर स्वातंत्र्य मिळाले आहे.
जॉर्ज, एलिझा आणि हॅरी अखेर कॅनडामध्ये पोहोचले आहेत आणि मुक्त झाले आहेत.",0.97
ENG-train-0038,"पण मी एक चांगला बॉस आहे, नाही का?
पण मी एक चांगला बॉस होतो, बरोबर?",0.97
ENG-train-0039,"आम्ही वेगासमध्ये खूप मजा केली!
आम्ही वेगासमध्ये खूप मजा केली!",0.97
ENG-train-0040,"त्याला कधीकधी ट्रंक असेही म्हणतात.
काही लोकांना याला ट्रंक असेही म्हणतात.",0.97
ENG-train-0041,"होय, मी एक मुलगी आहे आणि मला व्हिडीओ गेम आवडतात.
आणि हो, मला व्हिडीओ गेम्स आवडतात.",0.97
ENG-train-0042,"मला नुकतीच कळलं की मी गर्भवती आहे आणि मी तुला दोष देत आहे.
मला नुकतीच कळलं की मी गर्भवती आहे आणि ती तुझी चूक आहे!!!",0.97
ENG-train-0043,"तुमच्यासाठी हे फार महत्वाचे आहे, नाही का?
ते तुमच्यासाठी खूप महत्वाचे आहे, नाही का?",0.97
ENG-train-0044,"जॉन श्नाइडर खूप वृद्ध झाला आहे, मला तो शो 'ड्यूक्स ऑफ हॅझार्ड' मध्ये खूप आवडला होता.
जॉन श्नाइडर खूप चांगले वृद्ध झाला आहे. मी त्याला 'द ड्यूक्स ऑफ हॅझार्ड'मध्ये खूप प्रेम केलं.",0.97
ENG-train-0045,"याव्यतिरिक्त, पुरुष स्त्रियांपेक्षा नंतर परिपक्व होतात.
तसेच पुरुष स्त्रियांच्या तुलनेत उशीरा परिपक्व होतात.",0.97
ENG-train-0046,"कोणालाही ते सांगता येणार नाही, हे अधिकच वाईट आहे.
ते फक्त वाईट आहे जर कुणीही असं बोललं नसेल तर.",0.97
ENG-train-0047,"मग, वीस मिनिटांत, धावपट्टीवर एकत्र ये.
उड्डाण मार्गावर, 20 मिनिटांत.",0.97
ENG-train-0048,"ते अजूनही हवेत आहे.
तो अजूनही एक फसवणूक आहे.",0.97
ENG-train-0049,"मला आठवतं ते खूप चांगलं होतं.
मला आठवतंय. खूप छान होतं.",0.97
ENG-train-0050,"जर त्यांनी पैशांची मागणी केली तर त्यांना ना सांगा. तुम्हाला काम मिळाले नाही तोपर्यंत कोणत्याही एजंटला पैसे दिले जाऊ नयेत.
(जर ते पैशाची मागणी करतात, तर तुम्ही ""नाही"" म्हणता. तुम्हाला नोकरी येईपर्यंत कोणत्याही एजंटला पैसे दिले जात नाहीत.",0.97
ENG-train-0051,"आणि अशी मोठ्या संख्येने पेशी आहेत जी मज्जासंस्था बनवतात.
मज्जासंस्था मोठ्या संख्येने पेशींपासून बनलेली असते.",0.97
ENG-train-0052,"त्या गाण्याला मुलं त्यांच्या मैत्रिणींना वाजवतील.
आणि अगं ते गाणं त्यांच्या गर्लफ्रेंडसाठी वाजवतील.",0.97
ENG-train-0053,"ऐतिहासिक युरोपियन युनियन प्रवेशासाठी क्रोएशियाची उलटी मोजणी सुरू
युरोपियन युनियनमध्ये सामील होण्यासाठी क्रोएशियाची उलटी उलटी उलटी उलटी उलटी उलटी उलटी उलटी उलटी उलटी उलटी उलटी उलटी उलटी उलटी उलटी उलटी उलटी उलटी उलटी उलटी उलटी उलटी उलटी उलटी उलटी उलटी उलटी उलटी उलटी उलटी उलटी उलटी उलटी उलटी उलटी उलटी उलटी उलटी उलटी उलटी उलटी उलटी उलटी उलटी उलटी उलटी उलटी उलटी उलटी उलटी उलटी उलटी उलटी उलटी उलटी उलटी उलटी उलटी उलटी उलटी उलटी उलटी उलटी उलटी",0.97
ENG-train-0054,"जेव्हा अंडरडॉग जिंकतो तेव्हा मला आनंद होतो.
जेव्हा अंडरडॉग जिंकतो तेव्हा मला आवडते.",0.97
ENG-train-0055,"ग्रीन लँटर्नला डीसी कॉमिक्सकडून समलिंगी म्हणून पुन्हा सादर करण्यात येणार आहे.
ग्रीन लँटर्नला समलिंगी सुपरहीरो म्हणून पुन्हा लाँच करण्यात येणार आहे.",0.97
ENG-train-0056,"Moffitt म्हणाले की जीन्सच्या लांब किंवा लहान आवृत्त्यांच्या उपस्थितीसाठी व्यक्तींची चाचणी घेण्यापूर्वी या निकालांची दुसर्या अभ्यासात पुनरावृत्ती करणे आवश्यक आहे.
प्राध्यापक मोफिट म्हणाले की जीन्सच्या लांब किंवा लहान आवृत्त्यांच्या उपस्थितीसाठी व्यक्तींच्या चाचण्या सुरू करण्यापूर्वी या परिणामांची पुनरावृत्ती करणे आवश्यक आहे.",0.97
ENG-train-0057,"या प्राण्यांचा अभ्यास हा माझ्या आयुष्याचा ध्येय ठरला आहे.
मी आयुष्यभर या प्राण्यांचा अभ्यास केला आहे.",0.97
ENG-train-0058,"तो माणूस खात आहे.
एक माणूस अन्न खात आहे.",0.97
ENG-train-0059,"आंधळा माणूस म्हणाला, ""मी पाहतो"", तो आपली चाकू उचलून बघत होता.
मी पाहतो, असे आंधळा मनुष्य म्हणाला, तो त्याच्या चाकू उचलला आणि पाहिले.",0.97
ENG-train-0060,"माणूस आणि दोन तरुण मुले ट्रॅम्पोलिनवर उडी मारतात.
एक माणूस आणि दोन मुले ट्रॅम्पोलिनवर उडी मारतात.",0.97
ENG-train-0061,"ग्रेहाऊंड लोकांना वेगवेगळ्या ठिकाणी नेण्यात चांगली कामगिरी करते.
ग्रेहाऊंड तुम्हाला जाण्याची गरज असलेली ठिकाणे मिळविण्यात खूप चांगला आहे.",0.97
ENG-train-0062,"तो बंदूक उचलून ठेवला, आणि जरी ती थरथर कापत होती, तरीही ती डेव्हिडच्या दिशेने निदर्शनास आणत होती.
तोफाने अद्याप धक्का बसला होता, आणि जरी त्याचा हात थरथर कापत होता, तरी तो डेव्हिडवर कायमचे लक्ष्य करत होता.",0.97
ENG-train-0063,"माझ्या वडिलांच्या मित्रांची संख्या मला आश्चर्यचकित करते.
माझ्या वडिलांचे किती मित्र होते याचा मला आश्चर्य वाटले.",0.97
ENG-train-0064,"मला बिली टॅलेंट खूप आवडते. ते माझ्या आवडत्या गटांपैकी एक आहेत.
मी फक्त बिली टॅलेंटवर प्रेम करतो, ते माझ्या आवडीच्या व्यक्तींपैकी एक आहेत.",0.97
ENG-train-0065,"दोन स्त्रिया बाळासोबत पोझ करत आहेत.
दोन हसत स्त्रिया बाळाला हातात घेत आहेत.",0.94
ENG-train-0066,"आपले कार्य पूर्ण करण्यासाठी शुभेच्छा. जर तुम्हाला योग्य उत्तर मिळाले तर तुम्ही आणखी पाच गुण मिळवू शकता.
शुभेच्छा आणि तुम्हाला योग्य उत्तर मिळाले तर आणखी पाच गुण मिळतील?",0.94
ENG-train-0067,"त्यांचा पत्ता आहे: 47483 कनेक्टिकट डॉ, नॅशविले.
ते nashville मध्ये 47483 कनेक्टिकट ड्राइव्ह वर राहतात",0.94
ENG-train-0068,"त्याने सनग्लासेसची इच्छा असल्याचा दावा केला आहे.
तो म्हणतो की त्याला सनग्लासेस हवे आहेत!",0.94
ENG-train-0069,"वेगवेगळ्या भागात शोधत राहा. तेथे सभ्य, आनंददायी स्त्रिया आहेत.
वेगवेगळ्या ठिकाणी बघत राहा, तेथे सभ्य, मजेशीर, स्त्रिया आहेत.",0.94
ENG-train-0070,"मी चित्रपटसृष्टीत आणि गो-कार्ट रेसिंगला जायचं होतं.
माझ्या बॅलच्या रात्री मला सिनेमाला जायचं होतं आणि कार्ट रेसिंगला जायचं होतं!",0.94
ENG-train-0071,"जवळून, शेलचे तुकडे सुंदर दिसतात.
नजीकच्या दृष्टिकोनातून शेलचे तुकडे खूप छान दिसतात.",0.94
ENG-train-0072,"इव्हरी कोस्ट स्टॅम्पेडमध्ये सुमारे ६० जणांचा मृत्यू
आयवॉरी कोस्टमधील गर्दीत ६१ जणांचा मृत्यू",0.94
ENG-train-0073,"इतर कोणत्याही महिलेपेक्षा जास्त नाही.
इतर कोणत्याही मुलीपेक्षा जास्त नाही!",0.94
ENG-train-0074,"मी सहमत नाही, मला इमर्जन्सी आणि वाइल्डफायर आवडतात!
नाही, मला इमर्जन्सी आणि वाइल्डफायर आवडतात!",0.94
ENG-train-0075,"कोल्डप्ले अतिशय वेगाने लोकप्रिय होत आहे.
कोल्डप्ले खूप वेगाने येत आहे!",0.94
ENG-train-0076,"पीकमिन २ हा सीक्वल २००४ मध्ये रिलीज झाला होता.
2004 मध्ये गॅम क्यूबसाठीही Pikmin 2 नावाचा सीक्वल आला होता.",0.94
ENG-train-0077,"एक स्त्री आणि एक पुरुष पावसात नाचत आहेत.
पावसाळ्यात एक पुरुष आणि एक स्त्री नाचत आहेत.",0.94
ENG-train-0078,"मार्च ते एप्रिल या कालावधीत जामुन झाडे फुलतात.
जमुन झाड मार्च-एप्रिलमध्ये फुलते.",0.94
ENG-train-0079,"युरोपियन ससांच्या तुलनेत कॉटनटेल ससांना मायक्सामॅटोसिसला अधिक प्रतिरोधकता दिसून येते.
कॉटनटेल राबड्यांना युरोपियन राबड्यांसारखे सहज मिक्सोमेटोसिसची लागण होत नाही.",0.94
ENG-train-0080,"मी आणि माझ्या मैत्रिणींना मॅनिक्यूर करायला आवडायचे.
मला आणि माझ्या मित्रांना मॅनिक्युरसाठी बाहेर जायला आवडायचं.",0.94
