PairID,Text,Score
ENG-train-2700,"ऑरेंज वेस्टमध्ये बांधकाम कामगार चालतो.
अनेक बांधकाम कामगार एस्केलेटरकडे पाहत आहेत",0.5
ENG-train-2701,"मी असे लोक सहन करू शकत नाही जे जीवनासाठी समर्थ आहेत कारण त्यांचा मृत जन्म झाला आहे किंवा त्यांचा मृत्यू झाला आहे.
@SuePalmers @LSDsr माझ्याशी काहीही संबंध नाही. दुसर्या महिलेने काय निवडले ते ठरवणं हे माझं नाही आणि तुझंही नाही. #फेमिनिझम",0.5
ENG-train-2702,"मी हा चित्रपट अनेक वेळा पाहिला आहे.
मी त्यांना काही वेळा जिवंत पाहिले आहे.",0.5
ENG-train-2703,"तुम्हाला असे वाटेल की आनंद घेण्यासाठी फारसा प्रयत्न करण्याची गरज नाही.
आपल्या प्रयत्नांची संख्या वाढवा आणि आपण योग्य व्यक्ती शोधू शकाल.",0.5
ENG-train-2704,"एप्रिल २००७ मध्ये हे नाव नॉर्डिक पौराणिक कथांतील एक दिग्गज आणि आदिम दिग्गज यमिर यांचे नातू बर्गेलमिर यांच्या नावावरून देण्यात आले होते.
त्याचे नाव नॉर्वेजियन पौराणिक कथांमधून आले आहे, जिथे थ्रिमर हा जोटन किंवा थंड राक्षस आहे.",0.5
ENG-train-2705,"@ShowTruth नाही, मी हे स्पष्ट करू शकत नाही की आपण एखाद्या रुग्णाला निरोगी आणि आनंदी ठेवणार्या वैद्यकीय प्रक्रियेचा विचार हत्या म्हणून का करता.
.@RebeccahLouise मी कोणालाही काहीही करण्यास भाग पाडत नाही. गर्भपात 'वैद्यकीय मदत' नाही आणि चांगले पर्याय आहेत.",0.5
ENG-train-2706,"अख्योक शहराने वीजपुरवठा केला आहे.
अखिओक हे अलास्कामधील एक शहर आहे.",0.5
ENG-train-2707,"एक धावपटू रोबोट टोपी घालतो.
कुत्रा असलेला धावपटू शिडी ट्रकच्या जवळ येतो.",0.5
ENG-train-2708,"नासा त्याच्या डीप स्पेस नेटवर्कसह व्हॉयेजर 1 चा दररोजचा मागोवा घेत आहे.
त्याची माहिती स्पेनमधील मॅड्रिड येथील डीप स्पेस नेटवर्क स्टेशनच्या डेटाशी जुळवून घेण्यात आली.",0.5
ENG-train-2709,"यात त्सुशिमा आणि इकी यासारख्या मोठ्या संख्येने बेटांचा समावेश आहे.
यामध्ये २,५०० किमी पेक्षा जास्त क्षेत्रफळ असलेले सर्व बेटे आणि ५०० किमीपेक्षा जास्त क्षेत्रफळ असलेले इतर अनेक बेटे समाविष्ट आहेत.",0.5
ENG-train-2710,"दुकानात जाऊन एक प्रयत्न करा
एका दुकानात त्याची दुरुस्ती करा.",0.5
ENG-train-2711,"मला आश्चर्य वाटते की @HillaryClinton च्या विरोधात NEXT गोंधळवादी GOP स्लॅम काय असेल. तो निश्चितपणे येत आहे. फक्त अजून तपशील माहित नाही.
मला माझ्या नवीन हिलरी क्लिंटन शर्टची गरज आहे. ब्रुअरीमध्ये काही लोकांना भेटायला तिथे बर्नीच्या भेटीच्या संध्याकाळी.",0.5
ENG-train-2712,"या देशद्रोहीने राजकुमारीच्या जीवनाचा शेवट करण्याचा प्लॅन यशस्वी केला आहे का, किंवा इस्माई तिला सुरक्षित ठेवणार आहे का?
इस्माई हा एक उत्कृष्ट व्यक्तिमत्व आहे, आणि कथानक नवीन प्रकटीकरणांसह आणि आमच्या नायकसाठी सतत धोकादायक परिस्थितींसह कथा पुढे चालू ठेवते.",0.5
ENG-train-2713,"सर्वात मजेदार अपवाद वगळता, ते लागू होते.
आणि मुलांसोबत मजेशीर क्षणंचा आनंद घ्या.",0.5
ENG-train-2714,"बाहेरील शाही कुटुंबांना लाकलँड अभय येथे काय चालले आहे हे माहित आहे का?
जेव्हा एका राजघराण्यातील एका सदस्याला जादूची शक्ती असल्याचे आढळते, तेव्हा त्या सदस्याला बरे होण्यासाठी लॅकलँड अभय येथे पाठविले जाते.",0.5
ENG-train-2715,"या दुर्मिळ फुटेजमध्ये, प्रत्येकाची आवडती युद्ध नायक, कॅप्टन अमेरिका.
तुम्ही फोटोवर पाहिलेला गौरवशाली कॅप्टन, मातृभूमीचा सर्वात मोठा नायक.",0.5
ENG-train-2716,"जेवणाचे दरवाजे मोठ्या प्रमाणात उघडे होते.
एका श्वासाने, फराने दरवाजा मोठ्या प्रमाणात उघडला.",0.5
ENG-train-2717,"१८७७ साली वॉलसल टाऊन आणि १८७९ साली वॉलसल स्विफ्ट्सची स्थापना झाली होती.
त्यांचे मुख्यालय वॉल्सॉल येथे आहे, बर्मिंघॅमजवळ.",0.5
ENG-train-2718,"त्या पायांवर तो उभा नव्हता.
माणसाच्या पायांची किंमत नव्हती.",0.5
ENG-train-2719,"जिम ब्लेशरने स्वतःशी ही गोष्ट केली आहे.
कदाचित सुतारानेच या मालिकेतील काही स्थिरता जाणवली असेल, कारण शीर्षक काही कारणास्तव ""Changes"" आहे.",0.5
ENG-train-2720,"नुकत्याच त्यांनी स्थलांतरितांबद्दल केलेल्या टिप्पण्यांनंतर, डोनाल्ड ट्रम्प यांच्या व्यवसायाच्या हितसंबंधांना त्रास होईल असे तुम्हाला वाटते का? #ट्रंप
@realDonaldTrump ने बॉर्डरवर नियंत्रण मिळवले आहे! २०१६ मध्ये माझा मत आहे! #TCOT #ILLEGALSSTOLEJOBS",0.5
ENG-train-2721,"पण कॅट्रीनासोबत राहण्याची वास्तविकता आणि त्यातून निर्माण झालेला विनाश ही गोष्टीत चांगली भर घालते. विशेषतः जॉन्सन हे मुळचे नागरिक असल्यामुळे.
यामुळे माझ्या कथेचा आनंद वाढला.",0.5
ENG-train-2722,"या मालिकेच्या शेवटच्या दृश्यांसह सुसान पार्कमधून बाहेर पडली.
मी इतकी उत्सुक आहे की Susan तिच्या Witchlands मालिकेसह आमच्यासाठी काय ठेवली आहे हे पाहण्यासाठी!",0.5
ENG-train-2723,"आयव्ही चंचल आहे आणि तीक्ष्ण विनोद आहे, रेन सुंदर आहे आणि टिंकने मला सतत मोठ्याने हसायला लावलं.
रेन आणि आयवी एकत्र चांगले आहेत.",0.5
ENG-train-2724,"@thehill 2016 मध्ये #Democrat साठी मतदान करण्याचे आणखी एक कारण #ACAworks #GetMoneyOut #RestoreTheVRA #Bernie2016 #waronpoverty
Thanks @Chefs4Hillary for amazing names for canvassing #FITN",0.5
ENG-train-2725,"@realDonaldTrump आम्हाला ट्रम्प हवे आहेत! आम्हाला ट्रम्प हवे आहेत! आम्हाला ट्रम्प हवे आहे! #MakeAmericaGreatAgain
@ouchinagirl @TrumpNY2016 @GOP TRUMP FOR PRESIDENT AS HE DOES NOT MINCE WORDS!!!!",0.5
ENG-train-2726,"डोनाल्ड ट्रम्प प्रत्येकाला भुरळ घालण्यास घाबरत नाहीत.
@DannyZuker एका भाषणाने @realDonaldTrump स्वतः ला आर्थिकदृष्ट्या फसवू शकला. कल्पना करा की तो POTUS म्हणून आपल्यासाठी काय करू शकतो!",0.5
ENG-train-2727,"पहिल्या पिढीतील Zafira ला सामान्यतः Zafira A असे संबोधले जाते, जसे की Opel मॉडेलसाठी प्रथागत आहे.
मात्र, झाफीरा हा वेगळ्या सेगमेंटमध्ये होता, आणि जीएमने याचा विचार केला नव्हता.",0.5
ENG-train-2728,"गर्भपात क्लिनिक... एक फायदेशीर केंद्र आणि एअर कंडिशनरसह बॅक अॅले?
@wendydavis प्रार्थना? तुम्हाला वाटते की मी प्रार्थना करावी की गर्भपात आणि धोकादायक सुविधा अनियंत्रित राहतील? #facepalm",0.5
ENG-train-2729,"तुम्ही तिचे सहानुभूती, प्रेम आणि सामर्थ्य वाचताना पाहता.
ते वाचून आनंद झाला.",0.5
ENG-train-2730,"अॅटिकस हा खूप मजेशीर व्यक्तिमत्व आहे.
आणखी एक गोष्ट जी माझ्यासाठी चांगली नव्हती ती अशी होती की अॅटिकसने स्त्रियांबरोबर वागण्याची प्रवृत्ती होती.",0.5
ENG-train-2731,"या क्षणी इंटरफेसची कॉन्फिगरेशन अद्यतनित करू शकत नाही.
चॅनेलचे कॉन्फिगरेशन. अद्यतनित करण्यासाठी चिन्ह ड्रॅग करा.",0.5
ENG-train-2732,"पात्रांनी अपेक्षित बदल आणि वाढ केली, पण मला ते जाणवले नाही.
शेवटी ""प्रकटीकरण"", ज्यामुळे फुले पुन्हा वाढतात, ते खूप सोपे होते.",0.5
ENG-train-2733,"आणखी एक समस्या अशी आहे की, डिलन अंडिनचा बालपणीचा खेळपटू आहे जो तिच्यावर अनपेक्षित प्रेम करतो.
जेव्हा ती एक समुद्रकुमारी असते, तेव्हा सीसी अंडिनच्या बालपणीच्या मैत्रिणी डायलनला भेटते.",0.5
ENG-train-2734,"जेनिफर एनिस्टन आणि ब्रॅड पिट.
या अभिनेत्यांमध्ये ब्रॅड पिट, ज्युड लॉ आणि जेनिफर अनिस्तान यांचा समावेश आहे.",0.5
ENG-train-2735,"प्रिय #BristolPalin. STOP. फक्त FUCKING STOP. तुमच्याकडे पर्याय आहेत. याला #abortion म्हणतात. ते घ्या किंवा सोड पण गोंधळ थांबवा. #fem2
@NYCanegirl एका निर्दोष मानवी जीवनाची पूर्वनियोजित हत्या ही प्रथम श्रेणीची हत्या आहे, हे तुम्हाला ठाऊक आहे.",0.5
ENG-train-2736,"खेळाडू दागिने तीन वेळा फेकतो आणि तुकडे मुक्त करण्यासाठी एक जोडी मिळवण्याचा प्रयत्न करतो.
तो पुन्हा फेकतो आणि त्याच्या दोन तुकड्यांसह डॅसच्या बिंदू हलवावे लागतात.",0.5
ENG-train-2737,"मोझिला पब्लिक परवाना हा एक मुक्त आणि ओपन सोर्स सॉफ्टवेअर परवाना आहे.
डेबियन जीएनयू / लिनक्स हा एक वितरण आहे जो मुक्त सॉफ्टवेअरवर भर देतो.",0.5
ENG-train-2738,"@HillaryClinton @SenWarren ला VP म्हणून निवडून देईल - माझे ट्विट लक्षात ठेवा. #UnstoppableTicket #ElizabethWarren
तो सोमवारी रात्री आहे, तुम्हाला ठाऊक आहे की तुमचे हिलेरी समर्थक कोठे आहेत? रॉक हिलमध्ये आमच्या आश्चर्यकारक फोन बँकेत! ये आणि सामील व्हा! हिलेरी फॉर एससी",0.5
ENG-train-2739,"१९१९ मध्ये त्यांनी बावेरियन सोव्हिएत प्रजासत्ताकचा पराभव केला.
प्रत्येक सोव्हिएत प्रजासत्ताक आणि स्वायत्त सोव्हिएत प्रजासत्ताकाचे स्वतःचे शस्त्रे होते, जे मुख्यतः युनियनच्या शस्त्रेपासून प्रेरित होते.",0.5
ENG-train-2740,"जोसी इतरांसारखी खुई प्रणालीशी लढत नाही.
या मालिकेवर व्यसन करणाऱ्या कोणत्याही वाचकाप्रमाणे मी जोसी आणि हेडनच्या पुस्तकाची वाट पाहत होतो.",0.5
ENG-train-2741,"१९४९ मध्ये कराजान वियनाच्या संगीत मित्र संघाचे कलात्मक संचालक बनले.
१९५७ ते १९६४ पर्यंत ते व्हिएन्ना स्टेट ऑपेराचे कलात्मक संचालक होते.",0.5
ENG-train-2742,"ईडीबीच्या नकाशावर Slezska univerzita v Opave
S-servis bke, s.r.o. vybaveni strelnic ईडीबीच्या नकाशावर",0.47
ENG-train-2743,"तुम्ही ज्यांना ओळखत असाल त्यांना तुम्ही का आवडता?
अरे, तुला कोणीतरी कसं आवडतं ज्याला तू ओळखतोस?",0.47
ENG-train-2744,"@AlyssSmithh तिथे ती पँट सुइट हिलेरी आहे ती ओठ लपवण्यासाठी #HillarysDonors #HillarysBigAnnouncement #Benghazi #Obama #HillarysBigAnnouncement #HillarysBigAnnouncement #Benghazi #Obama #HillarysDonors #HillarysBigAnnouncement #HillarysBigAnnouncement #Benghazi #Obama
@NewtGingrich on @HillaryClinton: ""ती खूप जबरदस्त आहे. ती खूप सक्षम व्यक्ती आहे.",0.47
ENG-train-2745,"वर्ण छान होते, पण मला आशा आहे की आपण त्यांना अधिक पाहिले असेल.
हो, अडथळे होते, पण मला नेहमीच माहित होते की मुख्य पात्र त्यांच्यावर मात करेल.",0.47
ENG-train-2746,"@peiacsw कृपया समाजातील सर्वात असुरक्षित महिला म्हणून जन्माला आलेल्या मुलींच्या स्थितीचा विचार करा. #peivotes
@davebachman34 @Clifford1462 @msnbc तुम्हाला माहित आहे काय गर्भपात मोठ्या प्रमाणात कमी करते? लैंगिक शिक्षण आणि गर्भनिरोधक प्रवेश.",0.47
ENG-train-2747,"या आठवड्यात झालेल्या प्रगतीच्या व्यतिरीक्त सर्वोच्च न्यायालयाने टेक्सासमधील गर्भपात रुग्णालयांनाही खुला राहण्याची परवानगी दिली आहे! #SCOTUS
तुम्हाला शरीराच्या स्वायत्ततेच्या अधिकाराबद्दल काही माहिती आहे का?",0.47
ENG-train-2748,"माझी आवडती Metallica आहे आणि माझी सर्वात कमी आवडती हिलेरी डफ आहे.
मला खात्री आहे की हिलेरी डफ त्यापैकी एक होती.",0.47
ENG-train-2749,"Limewire शोध आणि डाउनलोड इंजिन डाउनलोड करण्याचा प्रयत्न करा, बाळ!
संपूर्ण गाणे गुगल सर्च इंजिनमध्ये आढळू शकते.",0.47
ENG-train-2750,"अशा भावना परत करू शकत नसलेल्या व्यक्तीवर प्रेम करण्याचा प्रयत्न का करावा?
जर मला तिच्याबद्दल भावना होत्या तर मी ती प्रतिसाद देऊन दाखवली असती.",0.47
ENG-train-2751,"प्रामाणिकपणे सांगायचे तर त्यांना मागील एक परत आणण्याची जबाबदारी आहे.
त्यांना खरोखरच जुन्या गोष्टी परत घालाव्यात लागतात.",0.47
ENG-train-2752,"जोआन बाल्डविन तिच्या जीवनाचे रक्षण करण्यासाठी मानवी हवामान रक्षकापासून जिन्नमध्ये बदलली गेली.
पण गोष्टी इतक्या सोप्या नाहीत. डेव्हिडने जोआनची निर्मिती करताना स्वतःलाच दुखापत केली आहे आणि तो तिला शक्ती देत आहे.",0.47
ENG-train-2753,"Final Thoughts: मला व्हॅम्पायर्स ऑफ मॅनहॅटन आश्चर्यकारकपणे मनोरंजक वाटले जरी मला या मालिकेबद्दल माहिती नसतानाही.
तुम्ही व्हॅम्पायर्स ऑफ मॅनहॅटनपासून सुरुवात करू शकता आणि सुंदरपणे पुढे जाऊ शकता.",0.47
ENG-train-2754,"काही लोक मुलासाठी तयार नाहीत किंवा त्यांना बलात्कृतही केले गेले आहे, आणि तेथे आधीच खूप मुले आहेत ज्यांना तरीही दत्तक घेण्याची आवश्यकता आहे
RT @PinkGypsySoul: समाजातील महिलांच्या प्रगतीसाठी सर्वात महत्वाचा घटक म्हणजे आपली फर्टिलिटी नियंत्रित करण्याची क्षमता.",0.47
ENG-train-2755,"बेलेन व्हेल सामान्यतः दात असलेल्या व्हेलपेक्षा मोठ्या असतात, आणि मादी मादी पुरुषांच्या तुलनेत मोठ्या असतात.
पुरुषांचे वजन 130 ते 200 किलो असते तर मादींचे वजन 35 ते 82 किलो असते.",0.47
ENG-train-2756,"ज्यात पॅरिस हिल्टन, लिंडसी लोहान, टॉम क्रूझ आणि केटी होम्स यांचा समावेश आहे.
पॅरिस हिल्टन हा स्पष्ट उत्तर आहे, नाही का?",0.47
ENG-train-2757,"बालके रॅफ्टमध्ये पाण्यावर तळतात.
चार मुले बाहेर एकत्र खेळत आहेत.",0.47
ENG-train-2758,"@marcorubio @GovernorPerry @GrahamBlog @McConnellPress तुमचे मौन गोंधळात टाकणारे आहे. #TrumpIsRight #SecureTheBorder #illegalaliens
जर एखादा उदारमतवादी इमिग्रेशनचा उल्लेख करत असेल तर त्यांना ""ट्रम्प"" कार्डने मारून टाका! #ट्रम्पफॉर प्रेसिडेंट #ट्रम्प #टकोट",0.47
ENG-train-2759,"तीन लोक समुद्राजवळ खेळत आहेत जेव्हा त्यांच्याजवळ लाटा शिखरावर येतात.
तीन पुरुष एकत्र आहेत आणि त्यातील दोन जणांनी निळ्या शर्ट घातल्या आहेत.",0.47
ENG-train-2760,"@HillaryClinton मी पोर्तुगीज आहे आणि मी तुमच्या मोहिमेला पाठिंबा देतो! शुभेच्छा! जगाला तुमच्यासारख्या व्यक्ती आणि महिलांची गरज आहे! #USA
@HillaryClinton यांनी तिला तिच्या मोहिमेमध्ये मदत करण्याची विनंती केली. आनंदाने (उत्साहाने) स्वीकारले!",0.47
ENG-train-2761,"दक्षिण आफ्रिकेतील सर्वाधिक लोकप्रिय खेळ म्हणजे फुटबॉल, रग्बी आणि क्रिकेट.
तथापि, रग्बी युनियन आणि ट्रॅक आणि फील्डसारख्या इतर खेळांमध्ये देखील मोठ्या प्रमाणात सराव केला जातो.",0.47
