PairID,Text,Score
ENG-train-4033,"पिवळे कपडे घालणारा माणूस एखाद्या पार्टीत स्मिर्नोफसाठी डीजे करत असल्यासारखा दिसतो.
पिवळा शर्ट घातलेल्या एका लहान मुलाला केळीचा आहार दिला जात आहे.",0.34
ENG-train-4034,"मला शस्टरमॅनचा मरणोत्तर जीवनाविषयीचा दृष्टिकोन खूप आवडतो, आणि तो एव्हरलॉस्टच्या स्केफॉल्डिंगचा वापर करून सर्व प्रकारच्या घटनांचे चतुरपणे वर्णन कसा करतो.
तो फक्त कच्चा प्रतिभावान आणि एक आश्चर्यकारक कल्पनाशक्ती आहे.",0.34
ENG-train-4035,"तिचे बोट खाली पडू शकतात तिचे पाय खाली पडू शकतात.
महान, हुक केलेले गुंडाळलेले गुंडाळे त्याच्या बोटांनी आणि पायांच्या बोटांनी.",0.34
ENG-train-4036,"चार्लीच्या वडिलांनीही काहीतरी योजना आखली आहे, पण चार्लीला काय माहित नाही, जरी असे दिसते की तो चार्लीच्या सौतेच्या आईला सोडून जात आहे.
चार्ली डेव्हिडसनच्या वेडेपणाचा भव्य ब्रँड सुरूच आहे.",0.34
ENG-train-4037,"'हर्ट ऑफ स्टोन' हे क्रिस्टीन वॉरेन यांच्या 'गार्गोयल्स' मालिकेतील पहिले पुस्तक आहे.
पण, सध्याच्या परिस्थितीत, पुस्तकाचा पहिला भाग मला मालिका सुरू ठेवण्यासाठी पुरेसे जिंकू शकला नाही.",0.34
ENG-train-4038,"त्याच्या वडिलांच्या नकाराने दुःखी होऊन, इडांटे पळून जातो.
त्याच्या वडिलांनी हे का सांगितले हे इडांटेला समजत नाही.",0.34
ENG-train-4039,"एक माणूस घोड्यावर सवार आहे.
एक माणूस गाडी चालवत आहे.",0.34
ENG-train-4040,"हा मच्छिमार आपले जाळे दुरुस्त करत आहे.
पायऱ्यावरील एक माणूस इमारतीची छप्पर दुरुस्त करतो.",0.34
ENG-train-4041,"टोव्ह हा प्रभावशाली होता आणि त्याची गणना करण्यायोग्य शक्ती होती, परंतु लेखक आणि मुख्य पात्राने अज्ञात कारणास्तव बाजूला ठेवले.
ती ठामपणे उभी राहते आणि तिच्यावर कोणताही प्रभाव पडणार नाही.",0.34
ENG-train-4042,"ब्लू मून या हॉररपेक्षा हा थोडा चांगला होता, परंतु तरीही तो मालिकेतील पहिल्याच्या उंचीवर पोहोचला नाही.
मला लगेच समजले की हे सर्वोत्तम कारण नाही, पूर्णतः शेवट देऊन, पण तरीही.",0.34
ENG-train-4043,"@Montel_Williams, माजी 2bit टॉक शो होस्ट, @realDonaldTrump बद्दल गप्पा मारत आहे.
@realDonaldTrump मी तुम्हाला @FoxNews वर पाहिले आहे. तुम्ही छान आहात! तुम्हाला माझा मत मिळाला आहे! #MakeAmericaGreatAgain #MakeAmericaGreatAgain #MakeAmericaGreatAgain #MakeAmericaGreatAgain #MakeAmericaGreatAgain #MakeAmericaGreatAgain #MakeAmericaGreatAgain #MakeAmericaGreatAgain #MakeAmericaGreatAgain #MakeAmericaGreatAgain #MakeAmericaGreatAgain #MakeAmericaGreatAgain",0.34
ENG-train-4044,"बांधकाम करणारा माणूस मोठ्या कंक्रीट टप्प्यांची पायाभरणी करत आहे.
एक पुरुष आणि एक स्त्री एक धातूची रचना एकत्र करतात.",0.34
ENG-train-4045,"""कॅफे एक्स्प्रेस"" चे चिन्ह ग्राफिटीने झाकलेले आहे.
एक तरुण स्केटबोर्डर ग्राफिटी झाकलेल्या रॅम्पवरून खाली उतरतो.",0.34
ENG-train-4046,"फक्त आयट्यून्सवर जा आणि आयपॉड शोध आणि संगीत पुन्हा त्यावर लाव.
एखाद्याला आयपॉड नॅनोवर चित्रे कशी ठेवायची माहिती आहे का?",0.34
ENG-train-4047,"जसे, ऐका, जेसीने सुजसोबत इतका वेळ घालवला आहे की तो त्याच्यासारखा जुन्या पद्धतीचा होण्याची इच्छा बाळगतो.
सुझीला अशी बूट आहेत की ज्यासाठी मी मरणार आहे?",0.34
ENG-train-4048,"एक वृद्ध संगीतकार बसतो, विचार करतो, ऐकतो आणि वाट पाहत असतो.
एक स्त्री सावलीत वाट पाहत आहे, तर एक वृद्ध, बसलेला माणूस मागेून तिच्याकडे पाहत आहे.",0.34
ENG-train-4049,"नदी पार करणारा काळा कुत्रा.
समुद्रकिनार्यावरील लाटेत एक मुलगी स्प्लॅश करत आहे.",0.34
ENG-train-4050,"मला विश्वास आहे की @HillaryClinton २०१६ मध्ये जिंकेल.
@chicagotribune #ayyylmao # डेमोक्रॅट्स आणि इतर #लिबरल लोकांना हे कळत नाही की कोणालाही #हिलरीक्लिंटन नको आहे जो #Obamanation 2.0 आहे?",0.34
ENG-train-4051,"मला असे वाटते की मला ह्या गोष्टीशी सामोरे जावे लागले की, ख्रिस पॅओलिनी हा त्याच्या पहिल्या पुस्तकापेक्षा मूलतः वेगळा लेखक आहे, एरॅगन.
या पुस्तकादरम्यान मला कंटाळा आला.",0.34
ENG-train-4052,"तुझ्या आईला क्षमा माग.
माझ्या आईसाठी एक प्रचंड कर्ज सोडून जात आहे.",0.34
ENG-train-4053,"आणि रेकॉर्डसाठी मी टीम Will ^-^
मी संपूर्ण दिवस टीम जेम आहे, दररोज.",0.34
ENG-train-4054,"ते अशा पुस्तकांपैकी एक आहे जे आपल्याला आशा देते की सर्व काही वाईट नाही.
जर तुम्ही चित्रपट ब्लेड २ पाहिला असेल तर मी तुम्हाला हे पुस्तक वाचण्याची शिफारस करणार नाही.",0.34
ENG-train-4055,"प्रत्येकजण ट्रम्प ट्रेनवर जा! @realDonaldTrump सह व्हाईट हाऊससाठी फर्स्ट क्लास वन-वे तिकीट आहे
@TIMENOUT @TIB2016 @AlanColmes हा #LobotomizedLiberal चा एक उत्तम उदाहरण आहे.",0.34
ENG-train-4056,"@HillaryClinton चे ट्विटर फॉलोअर्स त्यापेक्षा अधिक होते जेव्हा चार प्रमुख रिपब्लिकन उमेदवार (बुश, रुबियो, पॉल, क्रूझ) एकत्रित होते.
@foxnation ती त्यापासून मुक्त होण्याआधी हे करायला हवे होते! #NoHillary2016",0.34
ENG-train-4057,"अधिक माहितीसाठी या संकेतस्थळावर जा.
इंटरनेटवर डीप इम्पॅक्ट पहा.",0.34
ENG-train-4058,"बंगल्स हिवाळ्याच्या धुकेदार सावलीत.
तू हिवाळ्यासाठी बजेटवर आहेस.",0.34
ENG-train-4059,"दुसरे म्हणजे, ऑस्टर्सकडून आलेल्या धोक्याची पूर्तता करणे.
- दहशतवाद हा संघासाठी अजूनही धोका आहे.",0.34
ENG-train-4060,"जंगलात कच्च्या जमिनीवर उडी मारणारा एक अत्यंत माउंटन बाइकर.
एक तंदुरुस्त तरुण जंगलात डोंगराच्या भिंतीवर उडी मारत आहे.",0.34
ENG-train-4061,"@TPM @realDonaldTrump जेव्हा आपण आपले मोठे तोंड उघडता तेव्हा असे घडते. आपण या वेगाने 2016 साठी अपयशी आहात. #Univision
जर एखादा उदारमतवादी इमिग्रेशनचा उल्लेख करत असेल तर त्यांना ""ट्रम्प"" कार्डने मारून टाका! #ट्रम्पफॉर प्रेसिडेंट #ट्रम्प #टकोट",0.34
ENG-train-4062,"@realDonaldTrump चे उपक्रम रद्द केल्यास स्वतःला त्रास देण्याव्यतिरिक्त काहीही होईल असे प्रत्येकाला कसे वाटते हे मला आवडते. या माणसाला माझा मत आहे!
आम्हाला एक माणूस हवा आहे जो कठीण वाटाघाटी करेल, काय बोलायचे आहे ते सांगेल आणि राजकीयदृष्ट्या योग्य शब्द विसरेल. #धन्यवाद",0.34
ENG-train-4063,"निळ्या रंगाच्या तीन मुली, एक हात उभे करत आहे आणि बास्केटबॉल कोर्टवर लोक पार्श्वभूमीवर आहेत.
एक तरुण महिला एका परिषदेच्या कार्यक्रमात सशस्त्र दलाच्या तीन सदस्यांसमोर धक्का मारत आहे.",0.34
ENG-train-4064,"पीआयडी %1!u! प्रक्रियेला जबरदस्तीने बंद करण्यात आले.
%1 चा पासवर्ड पूर्ण झाला आहे.",0.34
ENG-train-4065,"चित्रपट पाहिला नसेल तर लोकांना हे पुस्तक विकत घेण्यास भाग पाडण्याचा कोणताही मार्ग नाही.
यामुळे मलाही हाच थंड पडला होता आणि तरीही मी माझ्या बेडवर जाऊन हे पुस्तक वाचण्यासाठी गुंडाळले होते!",0.34
ENG-train-4066,"त्याला मागील बाजूला गोळी लागली.
डॅनने पहिला ड्रॉ केला आणि शूट केला.",0.34
ENG-train-4067,"गॉस्ट ट्रॅप - रिक हाउटा - ही एक उत्तम झोम्बी कथा होती.
आकाशातून पडलेला झोम्बी - एम. बी.",0.34
ENG-train-4068,"पार्श्वभूमीवर मोठ्या इमारतीसह सुंदर दिवशी पाय उभे आहेत.
पार्श्वभूमीवर बस असलेल्या व्हॅनच्या मागे दोन पोलिस अधिकारी उभे आहेत.",0.34
ENG-train-4069,"हे पुस्तक मी वाचलेल्या सर्वात विनोदी पुस्तकांपैकी एक आहे!
शैली काही प्रमाणात मागील पुस्तकांच्या तुलनेत वेगळी वाटली आणि मी कथा किंवा पात्रांनी गुंतलेली नव्हतो.",0.34
ENG-train-4070,"१९६५ मध्ये, वरच्या यारा खोऱ्यात, मेरिसव्हिलजवळ एक वसाहती सापडली.
याकिमा शहर याकिमा काउंटीच्या वरच्या खोऱ्यात आहे.",0.34
ENG-train-4071,"Rise & Shine it's a new day & you're alive. देवाचे आभार 4 अनमोल जीवनाचा आणखी एक दिवस. #Christian #Catholic #TeamJesus
@LogicOfLife7 मी 'जीवनाचा हक्क' आणि 'किंवा कोणाच्या शरीराचा वापर करण्याचा हक्क-सहमतीशिवाय' गोंधळत नाही. तुम्ही का? #rapeculture",0.34
ENG-train-4072,"पुढील दोन हंगामातही त्याने ट्रॉफी जिंकली.
त्याने मॅचमध्ये शिंजिरो ओटानीला हरवलं, पण WCWने मालिका जिंकली.",0.34
ENG-train-4073,"@Molls30 @HillaryClinton मला हे आवडते! आमच्या सर्वात मोठ्या देणग्यांपैकी एक सौदी अरेबिया आहे. ते महिलांच्या अधिकारांना पूर्णपणे पाठिंबा देतात! #GoTeam
@GovChristie NJ चालवू शकत नाही आणि राष्ट्राध्यक्ष होऊ इच्छिते? मी @HillaryClinton च्या आधी त्याच्यासाठी मतदान करेन",0.34
ENG-train-4074,"तुम्ही प्रवासाला सुरुवात करू शकता, लांब प्रवासाला.
कॉटेजला थोडी ट्रिप घेण्याचा विचार केला आहे.",0.34
ENG-train-4075,"काळ्या टोपी आणि पोशाख असलेली एक स्त्री वाळूमध्ये बसली आहे.
हिरव्या टोपी असलेल्या माणसाजवळ वाळूमध्ये एक तपकिरी कुत्रा खेळतो.",0.34
ENG-train-4076,"मी एक वॉकरियस आहे, पण पॉईंट्सबद्दल धन्यवाद.
दोन मुद्द्यांसाठी याहू म्युझिकचे आभार.",0.34
ENG-train-4077,"कमीत कमी पाच वर्षांसाठी तुम्हाला दुसरा शोधायचा आहे.
मला खात्री आहे की मी त्याला कमीत कमी पाच वेळा सापडले आहे.",0.34
ENG-train-4078,"@AnneJp1946 मला गर्भनिरोधक सह कोणतीही समस्या नाही पण त्यांच्या आपण पुन्हा त्या विनामूल्य गोष्ट सह जा.
RT @spicysandwich: मला पुन्हा एकदा सांगा! गर्भपातविरोधी कायदे केवळ असुरक्षित, बेकायदेशीर गर्भपात घडवून आणतात!",0.34
ENG-train-4079,"#HillaryDebateQuestion म्हणून तुम्ही #MargaretSanger चे कौतुक करता ज्याने देशाला ""नेग्रो"" पासून मुक्त करायचे होते. कृपया स्पष्ट करा?
रात्री, शांत झोप, हिलेरीला खाऊ देऊ नकोस. @Tony_Tickets ""nightmares"" हे सर्व मी म्हणतो.",0.34
ENG-train-4080,"वाळूमध्ये खांद्यावर पडलेला कुत्रा.
एक तरुण मुलगा वाळू पिरामिडजवळ उभा आहे.",0.34
ENG-train-4081,"ग्रे शर्ट असलेला एक माणूस काँक्रीट भिंतीजवळ फिरत आहे.
एक लहान बाळ एक लहान काँक्रीट भिंतीवर स्केटबोर्डिंग",0.34
ENG-train-4082,"डेमोक्रॅट्स आणि #इस्लामिकस्टेट या दोघांची हत्या करण्यात आली आहे. फक्त फरक त्यांच्या बळींचे वय आहे. #आयएसआयएस
@nytimes Anti-choicers च्या मदतीने या विषयावर काम करणाऱ्या महिलांवरही गुन्हा दाखल होऊ शकतो.",0.34
ENG-train-4083,"तिने केलेल्या सर्व गोष्टींनंतर तो तिला सोडून देत नाही जे त्यांना धोक्यात आणते.
ज्युडला कापून तो गुंडाळला आहे की नाही हे सिद्ध करण्यासाठी, डॅमेनपासून गुप्त ठेवण्यासाठी जेणेकरून तो तिच्याशी संयम गमावू नये.",0.34
ENG-train-4084,"कदाचित साईजच्या काही सल्ल्याची गरज आहे, पण मी ते जेरोनवर सोडणार आहे!
जेरोन साईज या पुस्तकातून बरेच काही शिकतो, विशेषतः इतरांच्या भावना कसे पाहता येईल, आणि स्वतःचे कसे सामायिक करता येईल.",0.34
ENG-train-4085,"जर तुम्हाला #इक्विटी हवी असेल तर सर्व बाळांना जगू द्या!
@ghhshirley दुसर्या महिलेचा मृत्यू झाल्यानंतर खून केल्याचा आरोप",0.34
ENG-train-4086,"मला वाटते की हा पहिला एक पहिल्यापेक्षा चांगला होता, पण कदाचित मी केव्हिनने निर्माण केलेल्या जगाशी अधिक परिचित होतो.
पुढच्या वेळेसाठी माझी भूक कमी झाली आहे.",0.34
ENG-train-4087,"सूर्योदय पाण्यावर पडत असताना मागील बाजूला एक बोट फिरत असताना एक माणूस पायथ्याशी उतरत होता.
एक प्रचंड क्रूझ लाइनर सुंदर स्पष्ट पाण्याच्या किनार्यापासून क्षितिज व्यापते.",0.34
ENG-train-4088,"हिलेरीने खोटे बोलले आहे, बेंगाझीतील ईमेल हटवले आहेत, आणि अमेरिकन लोकांच्या विश्वासाला घोटाळा केल्यानंतर घोटाळा केला आहे.
आणखी एक @HillaryClinton बंपर स्टिकर मिळवणे कारण #LoveWins आणि 2 फक्त पुरेसे नव्हते",0.34
ENG-train-4089,"मतदानासाठी नोंदणी होईपर्यंत २९७ दिवस! १ वर्ष १९३ दिवस निवडणुकीच्या दिवसापर्यंत #RockTheVote #democrats #everyvotecounts
जर तुम्ही सध्या हिलेरी क्लिंटन यांचे भाषण पाहत नसाल तर तुम्ही तिचे ज्ञान गमावत आहात.",0.34
ENG-train-4090,"एका शेतात साइडिंगवर लोकोमोटिव्हची पंक्ती.
गडद तपकिरी घोडा शेतात उभा आहे.",0.34
ENG-train-4091,"एका मैदानाच्या मध्यभागी दोन तरुण एकमेकांशी लढा देत आहेत.
एका सामन्याच्या मध्यभागी वेगवेगळ्या संघांतील दोन हॉकी खेळाडू पिकचा पाठलाग करतात.",0.34
ENG-train-4092,"नवीन ई-मेल संदेश लवकर सुरू करण्यासाठी संपर्क क्षेत्रातील नावावर डबल-क्लिक करा.
जेव्हा तू हा संदेश ऐकशील, तेव्हा मला लगेच फोन कर.",0.34
ENG-train-4093,"या सर्व गोष्टी या मालिकेचे वाचन करण्याचे अतिशय महत्त्वाचे कारण आहेत, पण मला प्रामाणिकपणे सांगायचे आहे.
तो क्वचितच कोणाशीही संवाद साधू शकतो, त्यामुळे Amaranthe साठी त्याचा हळूहळू बदल होण्याची पद्धत वाचण्यासाठी आकर्षक आहे.",0.34
ENG-train-4094,"RT @alvedaking: या ग्रहासाठी सर्वात त्रासदायक गोष्ट म्हणजे आपल्या रस्त्यावर #HappyEarth च्या #Blood of #Children. #HappyEarth. #HappyEarth. #HappyEarth. #HappyEarth. #HappyEarth. #HappyEarth. #HappyEarth. #HappyEarth. #HappyEarth. #HappyEarth. #HappyEarth. #HappyEarth. #HappyEarth. #HappyEarth. #HappyEarth. #HappyEarth. #HappyEarth. #HappyEarth. #HappyEarth. #HappyEarth. #HappyEarth.
कायदेशीररित्या ट्विट करण्याऐवजी प्रजनन करण्याऐवजी गर्भधारणा न झालेल्या मुलाला भेदभाव करते. #worstargumentever #lolanti",0.34
ENG-train-4095,"चित्र पुन्हा आश्चर्यकारक होते, आणि खरोखरच कथा मध्ये काहीतरी जोडले.
पहिला चित्रपटही आश्चर्यकारक आहे.",0.34
ENG-train-4096,"परिपक्व सामग्री बहुतेक लोकांना आवडेल ज्यांना हा एनए शैली आवडतो पण तो माझा चहाचा कप नाही.
कदाचित सेक्समुळेच मला दंड मिळाला असेल, पण मी दुसऱ्यासाठी तयार आहे.",0.34
